{
  "assessment_digest": null,
  "comment_id": 5097284050,
  "content_digest": "sha256:85d2f7869b51c717130cb5e79924225b9f32680d6f543e118a1aac5f7dc57528",
  "created_at": "2026-07-27T22:01:30Z",
  "dedup_fingerprint": "sha256:73d986ec60ffb9d8fb27e0a77b2294b67ce376d0b75282689c10fc165f3ee8be",
  "issue_number": 5,
  "kind": "canonical_issue_response",
  "notes": "Bootstrap from live comment 5097284050 by EricSanchezok posted 2026-07-27T22:01:30Z.",
  "repository": "EricSanchezok/good-stuff-for-agents",
  "response_id": "cir_n5_bootstrap_9c10fc165f3ee8be",
  "response_variant": "bootstrap",
  "schema_version": 3,
  "template_version": "issue-factual-v1"
}
